{
  "id": {
    "local": "BIBSEC-12026-002"
  },
  "source": {
    "ecosystem": "bibliotheca"
  },
  "severity": "low",
  "published": "2026-05-01T00:00:00Z",
  "updated": "2026-05-08T00:00:00Z",
  "withdrawn": {
    "at": "2026-05-08T00:00:00Z",
    "reason": "Published in error"
  },
  "affected": {
    "volume": "github-provider",
    "purl": "pkg:volume/github-provider",
    "ranges": [
      {
        "type": "semver",
        "events": [
          {
            "introduced": "0"
          },
          {
            "lastAffected": "1.2.3"
          }
        ]
      }
    ]
  },
  "summary": "Withdrawn advisory fixture",
  "details": "This fixture demonstrates explicit advisory withdrawal lifecycle metadata."
}
